script_id,content
script-0002,the sun dipped below the horizon casting a golden glow over the city as people hurried to finish their day in the quiet library students gathered around tables their whispers merging with the rustle of pages and clicking of keyboards the garden was alive with the buzz of bees and the sweet aroma of blooming flowers inviting visitors to linger as the storm cleared a vibrant rainbow arched across the sky promising brighter days and a moment of peace the market was bustling with vendors shouting prices shoppers bargaining and the scent of fresh produce filling the air on the crowded train strangers shared a moment of laughter over a childs innocent antics creating a brief bond early morning joggers enjoyed the cool breeze and the empty streets their footsteps echoing in the quiet of dawn the chef presented the dish with pride its colors vibrant and inviting promising a feast for both eyes and palate in the workshop the sound of tools and the smell of wood shavings told stories of craftsmanship and dedication the old bookstore smelled of musty pages and history each book a portal to another time and place waiting to be explored
script-0003,the concert hall resonated with the harmonious blend of violins and cellos captivating the audience in a spell of musical bliss early risers at the beach watched the sunrise the sky a canvas of pink and orange hues reflecting on gentle waves in the bustling caf baristas crafted perfect cups of coffee the aroma mingling with the sound of frothing milk and casual conversations the hikers reached the summit just as the sun set the view transforming into a breathtaking panorama of fiery skies and distant mountains on the busy street a mime entertained passersby with his silent art drawing smiles and curious glances from the crowd the artists studio was cluttered with canvases and paints each stroke on the canvas a step towards the realization of a vision during the quiet midday in the park a lone saxophonist played soulful tunes his music floating through the rows of old trees at the weekend market artisans displayed their handmade goods the vibrant colors and unique designs attracting a crowd of eager shoppers the old man sat by the riverside feeding the ducks and watching the water reflect the everchanging sky above in the dimly lit jazz club the bands lively performance brought patrons to their feet dancing to the rhythm of the night
script-0004,the narrow alley was lit by strings of small lights creating a magical pathway that invited curious explorers into its depths the aroma of freshly baked bread wafted through the small bakery drawing locals in with the promise of warmth and comfort as the lecture ended students gathered their belongings buzzing with energy and discussing the new concepts they had just learned the small town celebrated its annual festival with music games and homemade food strengthening community bonds and creating cherished memories the gentle hum of the spinning pottery wheel blended with the soft methodical movements of the potter shaping his latest creation in the cool of the evening families spread blankets on the grassy hill to watch the outdoor movie stars twinkling above the antique shop was a treasure trove of history each item holding stories from the past eagerly shared by the knowledgeable owner runners lined up at the starting line their breath visible in the chilly morning air anticipating the challenging race ahead the wildlife photographer waited patiently in the hide camera poised to capture the rare bird as it appeared on the horizon the cozy book club met in the corner of the local library members animatedly discussing the twists and turns of their latest read
script-0005,the forest trail was blanketed in autumn leaves their crunch underfoot a constant companion to the hikers exploring the serene path the local farmers market bustled with activity as vendors proudly displayed the fruits of their labor under colorful canopies the village square came alive at dusk children playing tag while parents chatted amiably enjoying the cool evening breeze in the art gallery viewers moved from painting to painting deeply engrossed in the stories that each brushstroke told the community garden was a patchwork of vibrant colors and fragrances where neighbors shared both seeds and stories under the afternoon sun the moonlit beach was a haven for latenight wanderers the waves whispering secrets to the shore under a starstudded sky on the city rooftop friends gathered for a sunset barbecue the skyline offering a stunning backdrop to their laughter and conversations the small rustic cabin by the lake served as a perfect retreat for the writer her only interruption the call of the loons the school playground echoed with the joyful shouts of children during recess a lively break from the days lessons the amateur astronomer set up his telescope in the backyard the night sky a canvas for his passion and curiosity about the universe
script-0006,the quaint bookshop on the corner welcomes a steady stream of readers eager to lose themselves in new adventures daily every morning she takes a quiet walk with her dog along the path that winds through the softly whispering woods he always starts his day with a cup of black coffee and a fresh pastry while watching the sunrise quietly during the storm lightning painted the sky with brilliant streaks illuminating the dark clouds and rumbling thunder overhead dramatically this year their vacation plans include a trip to greece to explore ancient ruins and relax by the crystalclear seas the old clock tower in the town center reliably chimes every hour marking time with its deep resonant tones in her studio she meticulously paints landscapes that capture the tranquil beauty and subtle colors of the natural world the local park becomes a hub of activity on weekends filled with families enjoying picnics and childrens delighted laughter busy bees buzz energetically around the garden pollinating the vibrant flowers that bloom profusely throughout the warm sunny days they ended their day watching the sunset from the hill enjoying the peaceful close and the skys changing colors
